Title,Details
Fall 2010's Top Fashion Trends,"Is any woman as synonymous with another creature as Mariah Carey is with a butterfly?This week, the singer celebrated the 30th anniversary of the release of her groundbreaking album Butterfly, and now she celebrates the arrival of her collaboration with the jeweler Chopard, which launches in stores and online today, September 16. The pieces, a mix of butterflies rendered in diamonds on rings, bracelets, earrings, and a breathtaking statement necklace, commemorate Carey’s  longtime affinity for the creature who helped her conceptualize her life as an independent artist at the top of a male-dominated music industry. She describes the process of seeing and wearing the pieces, while simultaneously celebrating “my favorite album that I’ve done,” as an emotional experience. “It’s a major moment, and it’s a full circle moment,” she says. Here she tells us about conceptualizing the collection, her daily jewelry wardrobe, and how she will wear the pieces.Harper’s Bazaar: I want to start by talking about this incredible butterfly necklace. Mariah Carey: Oh my gosh.HB: The butterfly, of course, is this incredibly significant symbol of transformation for you. But seeing the butterfly rendered in diamonds reminded me of how dazzling they are. They’re the most beautiful living creatures. And I wondered if you learned anything about the butterfly, seeing it rendered in diamonds. The enduring symbol of the butterfly—I mean, we can go on and on about different people's interpretations and feelings. My own personal feelings are so very specific to my album Butterfly and that period of my life, which we are celebrating the anniversary of this year, [coincidentally] at the same time that this is all happening, right? Because we've been working on this [with Chopard] for two years together, and it happened by accident [that] we’re re-releasing the Butterfly album, which is my favorite album that I’ve done.And yes, I have a very specific relationship with the butterfly and just the whole metamorphosis of it. The way that I had to come through a very difficult time in my life and, you know, like they say, you’ve gotta go through something to get something. I had to get to that place where I felt empowered enough to metaphorically fly and be free from that place where I was. I started out in this industry as such a young girl in a really difficult world, dominated by men. I wrote this song as I was leaving this mansion that I had paid for half of, and [where] I had sort of created my own little prison, not really deliberately, but it ended up feeling that way. And I was leaving and I wrote the lyrics and the melody to [the song “Butterfly”]: Spread your wings and prepare to fly / for you have become a butterfly. And so that’s always stuck with me. I’ve made many albums since then, but it’s just very specific to me. So to see this magnificent butterfly necklace, and the ring—I mean, it was so much to even be able to say, I collaborated on this. To be able to admire the craft—I don’t want to say “craftsmanship.” Please give me another word.HB: The creation, the artistry?The artistry! That’s what it is. Just to be able to collaborate with Chopard and doing this collection is a humongous honor. I’m just here, ready to put some diamonds on and hang out. Whatever! Courtesy of Chopard.HB: What is your daily jewelry wardrobe? Are we wearing the butterfly ring every day and the necklace for special occasions? Or is there a different routine here?I am not really one for routines of any sort. I’m not a dancer. I don’t really like to follow rules. So I would wear any piece on any occasion. But right now i’m wearing a bracelet that my daughter made for me that says “Lamily” on it, which is an homage to my fans made of little beads and elastic, with some diamond bracelets. I would wear any piece from the collection in a casual moment, or more specifically the Happy Butterfly collection, which I love so much. I think they’re gonna look gorgeous stacked with even just a T-shirt and jeans, leggings, a simple dress. There’s just really great pieces that are attainable, as well as those gorgeous—I don’t find them over the top, some might say they are; they’re major—pieces that I live for.They are really major. And they feel so you. I can see you wearing this incredible butterfly necklace with a T-shirt, or these enormous leaf earrings.I would do that! I’m so ready to wear those. When Caroline [Scheufele, the president of Chopard] was evolving and creating them, she was explaining them to me and I knew exactly what she meant, but when I saw them, I was losing it. I mean, they’re just sick. It’s beyond. They’re so good. [Laughs.]Sounds like you and Caroline had good chemistry.I feel like Caroline probably has incredible chemistry with anyone cuz she’s so fun and carefree. I love that about her. She’s also an artist and a businesswoman, and to work with her to make this collection together, [it feels] even more extra special because it was my idea and I was able to watch it happen.Courtesy of Chopard.Would you say it’s true that diamonds are a girl’s best friend?Well, considering the people I know, for sure. Maybe the exception of one or two. You know, at the end of the day, they’re not going to steer you wrong! Do you feel like jewelry plays an important part in your life spiritually? It can be armor, but it also reflects the essential feminine aspects of who you are.That’s interesting. I’ve never thought of it that way. There were little things, little pieces that I’ve had throughout my life, where they did have their own—I wouldn’t say spiritual, but they had a sort of special significance to me where I would keep them on no matter what. Swimming, whatever I was doing, I would keep them on. Because they were that special to me. And at one point I lost a piece of jewelry that I loved so much, and it wasn’t even that it was a major thing. It just meant something to me. But with this collection, everything means so much to me that I’m just excited to share it with the world. Courtesy of Chopard.Rachel TashjianRachel Tashjian is the Fashion News Director at Harper’s Bazaar, working across print and digital platforms. Previously, she was GQ’s first fashion critic, and worked as deputy editor of GARAGE and as a writer at Vanity Fair. She has written for publications including Bookforum and Artforum, and is the creator of the invitation-only newsletter Opulent Tips."
"Three is a Trend: Full Metal Jacket, Resort 2014","Katie Holmes's classic street style has set its sights on the pants trend du jour: low-rise jeans. Yesterday, the Dawson's Creek alum was spotted out and about in New York City running errands while wearing an effortlessly stylish look. Her breezy, late-summer ensemble consisted of a blush pink spaghetti-strap cami tucked into a pair of baggy low-rise jeans in a light wash. She continued the minimalist approach with the rest of her outfit, wearing olive green flip-flops and carrying a maroon shoulder bag from A.P.C., eschewing jewelry entirely.BACKGRIDBaggy pants have made cameos in Holmes's street style before.Earlier this month, she made a cozy appearance in the city, accompanied by boyfriend Bobby Wooten III, while wearing an oversized slouchy pair of black trousers. She paired the statement pants with a classic light gray knit sweater with a red-and-cream pattern across the chest and shoulders, and finished the look with a brown leather cross-body bag.Back in June, the actress talked to BAZAAR.com about curating her sense of style, both on and off set.""I directed two films back-to-back this year, and I did the costumes as well, which made me appreciate my friends who are costume designers and all the costume designers I've worked with in the past,"" Holmes said of her work on Rare Objects and a still-untitled romance movie based in Connecticut. ""It made me appreciate silhouettes and cuts and color in a way I thought I had, but when you put it on camera, when you are trying to tell a story, you can see how clothing can do a lot of the work for you.""Of her personal wardrobe, she added, ""I love my T-shirts, and I love my vintage T-shirts. They're so yummy. They're a little dirty, a little stained or whatever, and that's me.""Chelsey SanchezDigital Associate EditorAs an associate editor at HarpersBAZAAR.com, Chelsey keeps a finger on the pulse on all things celeb news. She also writes on social movements, connecting with activists leading the fight on workers' rights, climate justice, and more. Offline, she’s probably spending too much time on TikTok, rewatching Emma (the 2020 version, of course), or buying yet another corset."
Sitting Pretty: Check Out Fall's Best Beauty Trends,"Starling, known for its sustainable mission and ethically sourced jewelry, is collaborating with creative director and fashion designer Carly Cushnie. The designer partnered with Starling's founder, Chelsey Bartrum, to design a handmade, 14-karat gold capsule collection featuring aquamarines and diamonds. The name of the collection, Where the Ocean Meets the Sky, was inspired, as Cushnie tells BAZAAR.com, by ""a hopeful horizon, which is the mixing of Eastern and Western coasts and cultures.""Bartrum on the left, Cushnie on the right, both wearing the collection.Ashley Randall PhotographyThe soothing blend of aquamarines and diamonds was the basis of the collection's inception. As Bartrum explains, there is a strong ""juxtaposition of the watery, soft aquamarine and the fiery strong diamond. More From Harper's BAZAARThe designer continues, ""Aquamarine means, 'water of the sea,' in Latin, and the word for diamond … stems from 'unbreakable' in Greek. By combining these stones and making a myriad of blues, silvers, and golds, the collection embodies strength and softness as one.""Ashley Randall PhotographyHorizon Eye Pendant - Carly Cushnie for StarlingHorizon Eye Pendant - Carly Cushnie for Starling$2,980 at starlingjewelry.comThe results are both beautiful and meaningful. The Horizon Eye Pendant, according to Starling's website, ""represents dreams, opportunities, and adventures. The evil eye is an ancient symbol meant to protect the wearer from evil spirits."" The inspiration behind each piece was delicately thought through; as Cushnie says, ""All of these pieces were purposely created to be beautifully worn, while also sending a message.""Both Cushnie and Bartrum sought out to create a collection that goes deeper than jewelry. As Bartrum explains, ""We wanted to thoughtfully design each piece in the collection in order to represent modern interpretations of shapes like the evil eye and the fan that symbolize the things we want to manifest in our own lives, including protection, wisdom, femininity, authority, and happiness."" Get in on the magic, as the collection is live now online at starling.com.Ocean Fan Necklace - Carly Cushnie for Starling$690 at starlingjewelry.comOcean Drop Earrings - Carly Cushnie for Starling$270 at starlingjewelry.comCoast Ring - Carly Cushnie for Starling$1,160 at starlingjewelry.comOcean Fan Earrings - Carly Cushnie for Starling$740 at starlingjewelry.comMelody LeibnerMelody Leibner is the Digital Editorial Intern forBAZAAR.com, where she covers e-commerce and shopping, fashion and celebrity news, and all things pop culture."
Trending Now In Our Store: Solid & Striped,"Worn by celebrities like Jennifer Lopez, Kendall Jenner, Tracee Ellis Ross, Millie Bobby Brown, and more, the '90s- and Y2K-inspired braided tendril trend has only increased in popularity since its reemergence during the 2022 festival season. ""The tendril trend has always been an easy way to add a little 'razzle-dazzle' to any updo,"" Erinn Courtney, a natural hair expert at StyleSeat and celebrity stylist, tells BAZAAR.com. Typically crafted as a set of smaller, face-framing braids, braided tendrils are an easy way to elevate a go-to bun or ponytail. You can also quickly enhance a salon-quality blowout or beachy waves by adding a second pair of braids near the ears for a summery, carefree hair look.View full post on InstagramView full post on InstagramWhen it comes to the styling essentials needed for a braided tendril updo versus wearing your hair completely down, professionals say there isn't much difference in the products and tools to keep in your arsenal. ""Re-creating this look at home is pretty simple,"" says celebrity stylist and Mane Addicts artist Irinel de León, who counts stars like Bella Hadid, Chrissy Teigen, and Hailey Bieber as clients. ""You'll need a little gel, a tail comb, and two small rubber bands—more if you're looking to add braids throughout the hair as well.""Shop the Braided Tendril Hair TrendGoody Ouchless Women's Clear Elastic Hair Tie (250 Count)Now 33% Off$5 at AmazonCredit: AmazonOribe  Gel Serum Radiance$63 at oribe.comCredit: Oribeghd Tail Comb$22 at GHD HairCredit: ghdTancho High Grade Tique Vegetable Pomade in Lavender$20 at AmazonCredit: AmazonCreme of Nature Argan Oil Perfect Edges$5 at Sally BeautyCredit: Sally BeautyEvolve Perfect Edge BrushNow 50% Off$5 at AmazonCredit: Amazonslip  Pure Silk 6-Pack Skinny Scrunchies $39 at NordstromCredit: NordstromDe Leon recommends starting off the look by centering your hair down the middle and creating two triangular parts on the left- and right-hand sides. Depending on the thickness of your hair and your desired braid size, she advises using around a dime-sized amount of gel to create each braid. ""For updos in particular, I love using a little barber's brush to smooth hair into a cute bun or pony,"" she adds. ""I also recommend applying gel around the perimeter of the hair, brushing it upwards, then securing it with a hair tie. And I'm obsessed with finishing the style with a wax Tancho stick, which is made out of lavender and vegetable oil. It's great for flyaways and tighter hairstyles.""View full post on InstagramView full post on InstagramIt's no secret that braided styles are a mainstay in summer beauty looks, as they're not only stylish, but also helpful in protecting your hair against elements like chlorine and excessive heat. ""Braided styles are popular during summer months, because they make it easier to get up and go, especially when traveling,"" Courtney notes. De Leon agrees, adding that an effective UV hair treatment can be the protective icing on the cake for any summer style, including braided tendrils.kerastase Huile Sirene Hair Oil Mist$30 at KerastaseCredit: KérastaseSisley Paris Hair Rituel Protective Hair Fluid$100 at Blue MercuryCredit: BluemercuryRita Hazan Lock Block Protective Spray $26 at DermstoreCredit: DermstoreTiffany DodsonAssociate Beauty Commerce EditorTiffany Dodson is currently the associate beauty commerce editor at Harper’s Bazaar, where she specializes in trend forecasting, building relationships with major and emerging brands, and crafting shopping stories—from holiday gift guides to product road tests. Tiffany's work has previously been featured in outlets like SELF, Bustle, and Teen Vogue, and she's been quoted as a commerce and beauty expert in publications and platforms like The Business of Fashion and NPR’s Life Kit podcast."
Trending Now In Our Store: Pajama Dressing,"Kendall Jenner's latest off-duty look goes back to the basics.Earlier this week, the reality TV star and model stepped out wearing an iteration of one of her classic summer uniforms. The ensemble was composed of sensible high-waisted straight-leg trousers in white and a salmon-colored cropped cardigan from Miaou. Jenner styled the look with this season's most covetable shoe option: the kitten heel. Her take on the trend involved an ivory pair resembling ballet flats and featuring the signature mini heels.For accessories, Jenner went subtle, opting for a black leather shoulder bag from The Row, skinny rectangular sunglasses, and a black belt.BACKGRIDSo far, the 818 founder's summer has been full of simple yet sophisticated looks like this one.Back in June, for instance, she put her own spin on the coastal grandmother trend by sporting a pair of powder-yellow shorts from Aritzia with a super-cropped gray tank top, plus a dusty-blue button-up from Almina Concept and a spacious black tote bag. In another outing, the model looked cool and casual in a black cami, a denim midi skirt from The Row, and a pair of black loafers, while flashing a bright orange wallet from Hermès.Jenner previously talked to BAZAAR.com about 818, her tequila brand.""It's been amazing to see how much 818 has accomplished in just over a year,"" she said in June. ""As we enter year two, I see 818 continuing to grow, engaging with our customers in new and interesting ways, and staying committed to our sustainability mission. I want us to be known for our delicious-tasting tequila and also for how we continue to give back to local communities.""Chelsey SanchezDigital Associate EditorAs an associate editor at HarpersBAZAAR.com, Chelsey keeps a finger on the pulse on all things celeb news. She also writes on social movements, connecting with activists leading the fight on workers' rights, climate justice, and more. Offline, she’s probably spending too much time on TikTok, rewatching Emma (the 2020 version, of course), or buying yet another corset."
Rihanna Looks Gorgeous in a Sheer Gown and Gold Body Jewelry,"Kendall Jenner took the coastal grandmother trend for a spin around Los Angeles this weekend.The supermodel stepped out to walk her dog on Sunday in a dusty blue crop top paired with loose powder-yellow shorts by Aritzia, an open baby blue button-up by Almina Concept, and black Adidas sneakers. She carried a large black shoulder bag and accessorized with matching sunglasses.Rachpoot/Bauer-Griffin//Getty ImagesTna big easy 5Tna big easy 5Now 25% Off$24 at AritziaJenner styled the look a bit differently for a second outing that day. Instead of the yellow shorts, she wore a pair of airy white Yoko pants from L.A.-based brand Leset. She also swapped her sneakers for some tan Birkenstocks.BACKGRIDThe Kardashians star shared a mirror video selfie of the second look on her Instagram Story.Kendall Jenner/InstagramJenner has been seen out and about various times over the past several days following her split from NBA star Devin Booker. Though she has not confirmed the breakup, various sources have said she and her boyfriend of two years were on ""different paths,"" and she asked him to give her some space.Rachpoot/Bauer-Griffin//Getty ImagesA day after news broke of the separation, Jenner was pictured stepping out of a studio in Calabasas wearing a canary-yellow cropped cami and high-waisted dark blue wide-leg jeans. She finished the look with a brown leather belt and black square-toe slingback flats.Over the weekend, the model also shared a tasteful nude photo of herself tanning by a pool. According to E!, Booker briefly liked the post. But he has unliked it since. Jenner also liked his most recent Instagram post.Rosa SanchezRosa Sanchez is the senior news editor at Harper's Bazaar, working on news as it relates to entertainment, fashion, and culture. Previously, she was a news editor at ABC News and, prior to that, a managing editor of celebrity news at American Media. She has also written features for Rolling Stone, Teen Vogue, Forbes, and The Hollywood Reporter, among other outlets."
